{
  "schema": "agentfem.benchmark-card",
  "schema_version": "0.1.0",
  "id": "agentfem.benchmark.jmps_weak_interface_convergence_v4",
  "title": "Two-dimensional weak-interface supershear refinement contract",
  "status": "experimental_v4_2d_convergence_accepted",
  "purpose": "Require preservation of the supershear mechanism, energy closure, and convergence of one representative fixed-distance front speed under proportional in-plane mesh refinement and explicit time-step refinement.",
  "physics": "near-incompressible finite-strain plane-stress Neo-Hookean strip with ten or more cells through the height, homogeneous preload, smooth remote impact, a fixed bilinear Mode-I cohesive interface, and a precrack",
  "execution": {
    "example": "benchmarks/dynamic_fracture.py",
    "command": "python -c \"from agentfem import benchmarks; print(benchmarks.jmps_weak_interface_convergence_v4().summary())\"",
    "evidence": "The opt-in public benchmark compares a 30x10 baseline, near-proportional 40x14 and 60x20 spatial refinements, and a 30x10 run with the stable time increment halved. It is kept outside per-commit CI because the complete local run is intentionally expensive."
  },
  "observables": [
    "Resolved supershear classification and fitted speed normalized by the prestrained reference-coordinate shear speed.",
    "Interface and transverse cell counts, stable time increment, disconnected failure, simultaneous failure fraction, and rapid distributed-failure fraction.",
    "A local 0.3-length speed window for peak-speed mechanism classification and one fixed x=[0.8,1.8] propagation interval for refinement convergence.",
    "Complete bulk, kinetic, cohesive, prescribed-work, and energy-balance ledger at retained frames.",
    "Least-squares fit quality and successive relative representative-speed changes under proportional spatial refinement and time-step halving.",
    "Separate mechanism_preserved and speed_converged decisions so a robust regime classification cannot be mistaken for an asymptotically converged crack speed."
  ],
  "acceptance": [
    "All four runs remain supershear with no failed islands ahead of the contiguous front.",
    "Every run closes the complete energy ledger within 0.5 percent.",
    "Every representative fixed-distance fit must have R-squared of at least 0.95.",
    "Each successive spatial representative-speed change must remain below ten percent.",
    "Halving the 30x10 time increment must change representative speed by less than two percent."
  ],
  "limitations": [
    "The four cases preserve resolved supershear, close the energy ledger, and pass the declared representative-speed refinement gates.",
    "The accepted result is a two-dimensional numerical mechanism and observation contract, not a publication-parameter fit or curve-level reproduction.",
    "The local plane-stress membrane still requires a thin-three-dimensional cross-check and an independent near-incompressibility study.",
    "The V4 interface is normally preloaded and therefore cannot use the traction-free principal surface-wave oracle as a prestrained Rayleigh boundary."
  ],
  "golden": {
    "reference_version": "v4-2d-fixed-distance-refinement-2026-08-08",
    "quantities": [
      {
        "name": "shear_speed_ratios",
        "expected": [1.2918787119, 1.1430328270, 1.0322491700, 1.2949750183],
        "relative_tolerance": 0.03,
        "absolute_tolerance": 0.02,
        "unit": null,
        "description": "Baseline, first spatial refinement, second spatial refinement, and temporal refinement fitted-front speed ratios."
      },
      {
        "name": "relative_speed_changes",
        "expected": [0.0099974282, 0.0240889158, 0.0009308806],
        "relative_tolerance": 0.1,
        "absolute_tolerance": 0.001,
        "unit": null,
        "description": "First spatial, second spatial, and temporal fixed-distance representative-speed changes used by the refinement gate."
      },
      {
        "name": "representative_fitted_speeds",
        "expected": [15.1500060930, 15.3029967045, 15.6807284512, 15.1359163626],
        "relative_tolerance": 0.01,
        "absolute_tolerance": 0.02,
        "unit": null,
        "description": "Least-squares crack-front speeds over the fixed reference-coordinate interval x=[0.8,1.8]."
      },
      {
        "name": "representative_fit_r_squared",
        "expected": [0.9904244966, 0.9941276851, 0.9972082621, 0.9904560100],
        "relative_tolerance": 0.001,
        "absolute_tolerance": 0.001,
        "unit": null,
        "description": "Fit quality for the fixed-distance representative speeds."
      },
      {
        "name": "relative_energy_errors",
        "expected": [0.0001874622, 0.0002428566, 0.0003309566, 0.0000628840],
        "relative_tolerance": 0.2,
        "absolute_tolerance": 0.00005,
        "unit": null,
        "description": "Final complete-ledger energy errors for the four refinement runs."
      }
    ]
  }
}
